text	id	annotator	annotation_id	created_at	updated_at	lead_time	answer
"President Trump could soon intervene in at least one of several cases in which U.S. service members have been accused of war crimes, according to people involved in the process, despite concern among some Pentagon leaders that such action could damage military discipline and morale. Families and attorneys for the accused saw the Veterans Day weekend as a possible window for Trump to issue pardons or help in other ways. The president has not spoken publicly about the cases in recent days but has questioned whether the service members were treated fairly and believes he has support among his political base to act, said the officials, speaking on condition of anonymity because of the sensitivity of the issue. “The president doesn’t seem to be constrained by any sort of timeline for these decisions, which contributes to higher intrigue and reasserts his prerogative as commander in chief,"" said one U.S. official with knowledge of ongoing conversations. Defense Secretary Mark. T. Esper discussed the issue with Trump last week, the official said, but it was something of a “courtesy” in which Esper likely “rehashed all the things [the president] expected to hear."" Trump has expressed an interest in pardoning service members accused of crimes, especially after the cases have been discussed on television, one former senior administration official said. In May, Trump pardoned former Army 1st Lt. Michael Behenna, who was convicted in the 2008 murder of an Iraqi prisoner suspected member of al-Qaeda. The discussion was renewed on Nov. 4 when Fox News personality Pete Hegseth announced that Trump was interested in taking action in the cases by Veterans Day. Trump is know to speak regularly with Hegseth. Alyssa Farah, a Pentagon spokeswoman, referred The Post to Esper’s previous comments on the issue. The Pentagon chief acknowledged last week that he had discussed the issue with Trump but declined to say whether he supports exonerating the service members involved. “But I do have full confidence in the military justice system and we’ll let things play out as they play out,” Esper added. “I offered ― as I do in all matters ― the facts, the options, my advice, the recommendations and we’ll see how things play out."" The cases include that of Army Maj. Mathew L. Golsteyn, a former Special Forces officer who faces a murder trial in the death of a suspected Taliban bomb maker; former Special Warfare Operator Chief Edward Gallagher, a Navy SEAL who recently was acquitted of the most serious charges against him but convicted of a lesser war crime; and former Army 1st Lt. Clint Lorance, who was convicted of second-degree murder in 2013 and is serving a 19-year prison sentence for ordering his soldiers to open fire on three men in Afghanistan. Trump could act next in the case of Lorance, who lost his case after nine members of his unit testified against him. Lorance’s relatives traveled to Fort Leavenworth in Kansas from several states this week in anticipation that Trump could set him free, said David Gurfein, a retired Marine who is assisting the family as the chief executive officer of United American Patriots, a nonprofit that raises money to help people charged with war crimes. Lorance’s supporters have argued that Army prosecutors in his case hid details, including that biometrics showed the men were affiliated with the Taliban. The U.S. Army Court of Criminal Appeals ruled in 2017 that the information would not have been permitted at a new trial. Gurfein said he is “very optimistic” Lorance could be released soon, though the details for how that would occur are not clear. An announcement could come Wednesday, Gurfein said, citing conversations with people who are “closest to the president.” Gurfein said he also anticipates action in Golsteyn’s case soon, but a defense official said that is not clear, especially considering how different the facts of the cases are. The options available to the president in Lorance’s case include granting a full pardon, shortening his prison sentence or disagreeing with previous findings in the case. Golsteyn’s case, involving the 2010 death of a man in Afghanistan’s Helmand Province, has been at the center of an Army investigation for years. The incident came under scrutiny in 2011 after he applied for a job with the CIA and disclosed during a polygraph test that he had killed someone on deployment and burned the body, according to Army documents and a previous interview with Golsteyn. The Army closed the case without bringing charges against him in 2013, electing to punish him administratively instead, revoking his Special Forces tab and taking away a Silver Star awarded for valor. But, citing undisclosed new evidence, the service re-opened the case and brought a murder charge against him in late 2018, prompting Trump to tweet on two occasions that he would review the case. A court-martial is scheduled for next year. “The case of Major Mathew Golsteyn is now under review at the White House,” Trump tweeted in October, tagging Hegseth in the post. “Mathew is a highly decorated Green Beret who is being tried for killing a Taliban bombmaker. We train our boys to be killing machines, then prosecute them when they kill!” Golsteyn has acknowledged killing the man but said the incident occurred during a lawful ambush after he was detained and released. In a statement released Monday night, Golsteyn said he is “incredibly grateful” for Trump’s attention on the case and that Esper’s intervention over the last week has raised new questions about fairness. “I am glad that the absence of impartiality in the military justice system is being exposed on a national scale so that it can be remedied, but saddened at the same time over the clear lack of moral courage in our senior leaders in DOD,” he said. In Gallagher’s case, a murder trial against him fell apart in June after another SEAL in his unit testified in court that he had actually killed a wounded Islamic State detainee in Iraq at the center of the case. Gallagher was convicted instead of taking a photograph with an Islamic State corpse and demoted him one rank to petty officer first class. Gallagher is seeking to have his old rank reinstated before he retires, said his attorney, Tim Parlatore. Gallagher appeared on a Fox News segment with Hegseth over Veterans Day weekend, but his attorney said he is not speaking with the White House or trying to influence Trump. Rachel VanLandingham, a military justice expert at Southwestern Law School in Los Angeles, said that Trump has the right to taken action in the cases as commander in chief. But she argued that doing so will have consequences, and that acting in Golsteyn’s case before it is tried would undermine commanders. “No president in my knowledge since the enactment in 1950 of the [Uniform Code of Military Justice] has so interfered in an ongoing court-martial with its panoply of due-process safeguards,” she said. “What Trump is doing is the opposite of due process — it’s tyrannical.” Josh Dawsey contributed to this report."	700	26	678	2023-04-24T20:34:38.950545Z	2023-04-24T20:34:38.950611Z	5691.728	"[{""start"": 2238, ""end"": 2570, ""text"": ""The cases include that of Army Maj. Mathew L. Golsteyn, a former Special Forces officer who faces a murder trial in the death of a suspected Taliban bomb maker; former Special Warfare Operator Chief Edward Gallagher, a Navy SEAL who recently was acquitted of the most serious charges against him but convicted of a lesser war crime;"", ""labels"": [""cause""]}, {""start"": 2571, ""end"": 2768, ""text"": ""and former Army 1st Lt. Clint Lorance, who was convicted of second-degree murder in 2013 and is serving a 19-year prison sentence for ordering his soldiers to open fire on three men in Afghanistan."", ""labels"": [""cause""]}, {""start"": 5057, ""end"": 5359, ""text"": ""Mathew is a highly decorated Green Beret who is being tried for killing a Taliban bombmaker. We train our boys to be killing machines, then prosecute them when they kill!” Golsteyn has acknowledged killing the man but said the incident occurred during a lawful ambush after he was detained and released"", ""labels"": [""cause""]}, {""start"": 5812, ""end"": 6162, ""text"": ""In Gallagher’s case, a murder trial against him fell apart in June after another SEAL in his unit testified in court that he had actually killed a wounded Islamic State detainee in Iraq at the center of the case. Gallagher was convicted instead of taking a photograph with an Islamic State corpse and demoted him one rank to petty officer first class"", ""labels"": [""cause""]}]"
Judges in the Appeals Chamber of the International Criminal Court on Thursday authorized Chief Prosecutor Fatou Bensouda to open an investigation into alleged U.S. war crimes in Afghanistan. This is a big milestone in international criminal justice — for the first time in history, U.S. leaders, armed forces and intelligence personnel may face a trial in an international court for crimes perpetrated in the context of the nation’s wars abroad. In April, the Pre-Trial Chamber rejected Bensouda’s first request for an investigation. On Thursday, Secretary of State Mike Pompeo condemned the Appeals Chamber’s overturning of the decision, calling the ICC “an unaccountable political institution masquerading as a legal body.” What are the alleged abuses? How does the ICC have jurisdiction over the United States? What will ordinary U.S. citizens make of an ICC investigation? My research explains how U.S. citizens are more supportive of the ICC than the Trump administration’s rhetoric suggests. In 2006, the ICC’s Office of the Prosecutor (OTP) opened a preliminary examination into allegations of war crimes and crimes against humanity in the Afghan conflict since 2003 — the year Afghanistan became a member of the ICC. The OTP examined allegations of abuses by both anti-government and pro-government forces, including the Taliban, the Afghan National Security Forces, the United States, armed forces and the CIA. The OTP says the information it gathered indicates, among other allegations, that U.S. interrogation techniques used in Afghanistan — involving “torture, cruel treatment, outrages upon personal dignity, and rape” — amount to war crimes. The United States is not a member of the ICC. However, the treaty that created the court, the Rome Statute, allows it to investigate citizens of nonmember states if the alleged crimes occurred on the territory of a member state. Once Afghanistan ratified the Rome Statute and joined the ICC in 2003, U.S. military and intelligence personnel in Afghanistan came under the court’s jurisdiction. In November 2017 — after more than a decade of gathering evidence — the prosecutor requested authorization to open a full investigation, arguing there was “a reasonable basis to believe” U.S. military and intelligence personnel committed war crimes. A year and a half later, in April 2019, the Pre-Trial Chamber unanimously rejected the request. The judges agreed the request was in the ICC’s jurisdiction and admissible before the ICC. However, they claimed the investigation would probably not be successful and, therefore, it would not serve the interests of justice to proceed. The 2019 decision sparked controversy in the human rights community. Amnesty International and Human Rights Watch issued statements criticizing the court’s judges for capitulating to the Trump administration’s threats and, in the process, abandoning the victims of the alleged crimes. Bensouda swiftly appealed the decision. Her office coordinated a multifaceted response, drawing on submissions from victims’ legal representatives and amicus curiae briefs from human rights organizations. On Thursday, the Appeals Chamber unanimously reversed the Pre-Trial Chamber’s decision, saying it had gone beyond its power by rejecting the prosecutor’s request. The Rome Statute requires only that the Pre-Trial Chamber determine whether “there is a reasonable basis to proceed with an investigation” and whether “the case appears to fall within the jurisdiction of the Court.” Since these facts were not in dispute, there was no basis to reject the prosecutor’s request. Last week’s decision authorizes Bensouda and her team to proceed with the investigation. The Appeals Chamber also granted permission for the prosecutor and her team to investigate allegations of abuses that related to the conflict in Afghanistan but that occurred outside the territory strictly defined — notably in CIA “black site” detention facilities in Poland, Romania and Lithuania. Pompeo stated in a news briefing Thursday that “we’re going to take all the appropriate actions to ensure that American citizens are not hauled before this political body to settle a political vendetta.” It is not yet clear what these actions will involve, but it seems unlikely the Trump administration will support the ICC investigation. The Trump administration has long been hostile toward the ICC. President Trump’s statement from last April criticized the court’s “broad, unaccountable prosecutorial powers; [and] the threat it poses to American national sovereignty.” The administration has also shown its disapproval of the ICC by revoking U.S. visas for ICC personnel and threatening financial sanctions against ICC judges and prosecutors. However, obstructing the ICC may be less popular with the U.S. public than one might think. My survey findings, detailed last April in the Monkey Cage, reveal the U.S. public is not hostile to the ICC. In an article recently published in the International Studies Quarterly, I find the majority of Americans (56 percent) support the ICC and actually believe the United States should become a member. This number grows to 65 percent when Americans are told about how the court is a vehicle for promoting democratic values, such as accountability and human rights. My research indicates that unlike the administration, ordinary citizens are more concerned about the ICC’s fairness and competence — and less concerned about whether U.S. personnel may be investigated. If Bensouda and her team can demonstrate impartiality and effectiveness in their work, they are likely to enjoy the trust and support of the U.S. public. In turn, this support might put pressure on policymakers to comply with the ICC investigation in the weeks, months and very likely years to come. Don’t miss anything! Sign up to get TMC’s smart analysis in your inbox, three days a week. Kelebogile Zvobgo (@kelly_zvobgo) is founder and director of the International Justice Lab at William &amp; Mary and a PhD candidate in political science and international relations at the University of Southern California.	699	26	677	2023-04-21T15:30:59.177869Z	2023-04-21T15:30:59.177928Z	374.453	"[{""start"": 0, ""end"": 190, ""text"": ""s in the Appeals Chamber of the International Criminal Court on Thursday authorized Chief Prosecutor Fatou Bensouda to open an investigation into alleged U.S. war crimes in Afghanistan."", ""labels"": [""cause""]}, {""start"": 998, ""end"": 1224, ""text"": ""In 2006, the ICC’s Office of the Prosecutor (OTP) opened a preliminary examination into allegations of war crimes and crimes against humanity in the Afghan conflict since 2003 — the year Afghanistan became a member of the ICC."", ""labels"": [""cause""]}, {""start"": 1225, ""end"": 1418, ""text"": ""The OTP examined allegations of abuses by both anti-government and pro-government forces, including the Taliban, the Afghan National Security Forces, the United States, armed forces and the CIA"", ""labels"": [""cause""]}, {""start"": 1420, ""end"": 1655, ""text"": ""The OTP says the information it gathered indicates, among other allegations, that U.S. interrogation techniques used in Afghanistan — involving “torture, cruel treatment, outrages upon personal dignity, and rape” — amount to war crimes"", ""labels"": [""cause""]}, {""start"": 2050, ""end"": 2298, ""text"": ""n November 2017 — after more than a decade of gathering evidence — the prosecutor requested authorization to open a full investigation, arguing there was “a reasonable basis to believe” U.S. military and intelligence personnel committed war crimes"", ""labels"": [""cause""]}, {""start"": 1420, ""end"": 1655, ""text"": ""he OTP says the information it gathered indicates, among other allegations, that U.S. interrogation techniques used in Afghanistan — involving “torture, cruel treatment, outrages upon personal dignity, and rape” — amount to war crimes"", ""labels"": [""causal-query""]}]"
On May 6, the White House announced that President Trump had granted clemency to Michael Behenna, a former Army lieutenant convicted of murder. That’s effectively a full pardon for Behenna, sentenced to 25 years in prison for taking Ali Mansur, a suspected bombmaker, for an unsanctioned interrogation in 2008 — and then shooting Mansur in what he claimed was self-defense. The White House cited “broad support from the military.” As evidence, it pointed to the fact that 37 retired generals and admirals, many with senior overseas command experience, had signed a 2013 amici curiae to the Supreme Court asking the justices to review the law of combat self-defense in this case. Does any of this erode the military’s independence from politics, a stance that’s a key feature of a healthy democracy? Both the White House’s influence on military justice and ex-military officers’ involvement in politics could have repercussions for the military’s credibility and effectiveness. Here are four takeaways from recent events. 1. Presidents’ intervention in military justice has been controversial before President Barack Obama was — and still is — criticized for in 2017 commuting the sentence of former Army soldier Chelsea Manning, convicted of leaking classified material to WikiLeaks in 2013. Several senior Democrats denounced the pardon at the time; as Sen. Robert Menendez (D-N.J.) put it, the issue was “what message do we send” to others who might consider the same. In similar ways, observers such as civil-military scholar Jason Dempsey criticize Trump’s pardon of Behenna as potentially undermining the military’s ethical code against atrocities — since the killing occurred during an unsanctioned interrogation after Mansur had been released. And the ACLU charges that the pardon implicitly sanctions war crimes. 2. But Trump’s intervention is consistent with his record in similar cases Under military law, commanders are enjoined from any behavior that might influence ongoing military judicial proceedings, including giving opinions about how they should be decided. So is the president — as commander in chief — subject to this restriction over “undue command influence”? Legal scholars are debating that — because Trump has been commenting on, and influencing, ongoing trials. For instance, then-candidate Trump denounced former Army soldier Bowe Bergdahl for leaving his post in Afghanistan in 2009, after which Bergdahl spent nearly five years captured by the Taliban. After Trump took office, Bergdahl’s defense team argued that a fair trial was no longer possible, given the president’s damaging rhetoric. Or consider the cases of Navy SEAL Eddie Gallagher and Army Special Forces Officer Matt Golsteyn. Gallagher is awaiting trial on charges that, without authorization or combat justification, he killed a prisoner in Iraq — and then held his reenlistment ceremony with the victim’s corpse. This March, Trump tweeted that Gallagher would be moved to “less restrictive confinement” in honor of his service to his country. And Golsteyn was investigated by the Army for the unsanctioned killing of an unarmed Taliban fighter in 2010, an investigation that was reopened when Golsteyn admitted to the killing on Fox News in 2016. In December, Trump tweeted that Golsteyn was a “U.S. Military hero” whose case he would be “reviewing.” That concerns legal scholars. Retired Air Force Lt. Col. Rachel VanLandingham told the military affairs site “Task &amp; Purpose” that such interventions damage the military justice system’s credibility, arguing, “The more Trump meddles, the more he undermines that system as being impartial and fair.” 3. Don’t expect this to change public opinion of the military Even if civil-military and legal scholars debate the pardon decision, don’t expect it to damage public opinion of the military. Polls regularly find that Americans rank the military as the most trusted institution in U.S. society. And Republicans especially favor the armed forces, as my own research finds. Here’s how I did my research. In 2017, I conducted a survey experiment on a nationally representative panel of 1,000 YouGov respondents. Survey respondents read negative news stories on different types of military institutional misconduct, including war crimes, organizational scandals and battlefield missteps. When compared to a control group that had read unrelated stories, Democrats and independents who read these accounts registered significantly lower levels of confidence in the military as an institution. However, Republicans’ impressions of the military remained steadily high. In some cases, these partisans expressed higher confidence in the military than those who did not read these accounts — as if “doubling down” to defend a favored institution. Further, that group was less likely overall to receive such negative information given media consumption habits. My findings are consistent with other surveys over recent years. But if many Americans do not find the pardon problematic, it probably is because the public may be unmoved by the underlying misconduct. In a 2016 Reuters-Ipsos survey, a majority supported the use of torture on suspected terrorists, although Republicans (82 percent) did so far more than Democrats (53 percent). In other words, a sizable proportion of the electorate is unlikely to lower its opinion of the military, and another constituency may actively defend it. 4. The retired military elite got engaged — in a different way Defense leaders have continued to express frustration that, increasingly, former military officers are becoming politically active. For instance, during the 2016 presidential election, retired generals made appearances at both major party conventions. Ex-military voices have only gotten louder since Trump took office, denouncing administration policy on issues that include climate security, torture, LGBT rights, security clearances and relations with the media. The services are trying to curb this advocacy. The 37 retired officers who signed the Behenna amicus brief aimed to influence the Supreme Court on a relatively minor point. That the White House appealed to that brief in justifying this pardon suggests both that retired military officers can influence political decision-making — and also that the military’s brand can be used for political purposes. Many scholars believe that having a nonpartisan military is one hallmark of a functioning democracy. Will these events — both the president’s attempt to sway the course of military justice, and ex-military officers’ attempt to influence politics — tarnish that? Correction: An earlier version of this article inaccurately said that Pres. Barack Obama had pardoned Chelsea Manning; fact he commuted her sentence. The story has been updated to correct the error. Michael A. Robinson (@m_robinson771) is an assistant professor of international affairs at the U.S. Military Academy at West Point and an active-duty Army captain. He holds a PhD in political science from Stanford University where his research focused on civil-military relations and institutional credibility. The views expressed are those of the author and do not reflect the official policy or position of the Department of the Army, the U.S. Military Academy, the Department of Defense, or any part of the U.S. government.	698	26	676	2023-04-21T15:24:40.851457Z	2023-04-21T15:24:40.851565Z	28201.69	"[{""start"": 144, ""end"": 372, ""text"": ""That’s effectively a full pardon for Behenna, sentenced to 25 years in prison for taking Ali Mansur, a suspected bombmaker, for an unsanctioned interrogation in 2008 — and then shooting Mansur in what he claimed was self-defens"", ""labels"": [""cause""]}, {""start"": 3040, ""end"": 3243, ""text"": ""And Golsteyn was investigated by the Army for the unsanctioned killing of an unarmed Taliban fighter in 2010, an investigation that was reopened when Golsteyn admitted to the killing on Fox News in 2016."", ""labels"": [""cause""]}]"
