text	id	answer	annotator	annotation_id	created_at	updated_at	lead_time
“Where I work, Culiacán, in the state of Sinaloa, Mexico, it is dangerous to be alive.” That's what Mexican journalist Javier Valdez said not too long ago, in 2011, when he accepted an International Press Freedom award from the Committee to Protect Journalists. Not only did Valdez work in one of the world's most dangerous countries for reporters — he also did some of the most dangerous work, covering crime and corruption in one of Mexico's most violent states. “To do journalism is to walk on an invisible line drawn by the bad guys — who are in drug trafficking and in the government — in a field strewn with explosives,” he said at the time. “This is what most of the country is living through. One must protect oneself from everything and everyone, and there do not seem to be options or salvation, and often there is no one to turn to.” On Monday afternoon, he was fatally shot near the offices of the newspaper he founded, Riodoce. He is the fifth reporter killed this year in Mexico, and his death comes just one day after about 100 assailants attacked seven national and international journalists covering a security operation in the state of Guerrero. They were on the highway that leads to Iguala, where 43 students from a teacher training college vanished in 2014. Riodoce, which Valdez founded in 2003, focused almost exclusively on crime and corruption. The reporter was an expert on drug trafficking and organized crime, subjects he covered extensively in his books. It was a dangerous enterprise, and Valdez had come under attack before. In 2009, assailants hurled a grenade into the Riodoce newsroom. Valdez, who also worked as a correspondent for the national newspaper La Jornada, specialized in chronicling the human toll of the violence in Mexico. In a story from 2014, he described the pain of realizing that your child has been kidnapped: Raúl felt like his eyes were filling with shattered glass. The tears didn’t beg permission. They began to fall. They ran down his skin. One of his children had been kidnapped. The police said it was an abduction. But he knew instantly that they were going to call to ask for ransom. His cell phone rang. It rang to the tune of El palo verde. Its macabre sound during this tragedy made him feel ashamed. His sixteen-year old son. The middle child. He saw his wife bowled over, brought low, sat in an armchair with the pain of rushing salty tears drying her out.… He hit the green button on the Motorola and let out an imperceptible tremulous hello. Look you son of a bitch we have your kid. He pointed the phone at the boy so that he could let out the terrified cry of dad. He asked for money in exchange for letting him go and he explained where and how to drop it off.… He cried again. He begged him not to hurt his boy. He got the money together and he delivered it. He didn’t tell the police because he was afraid. They are one and the same his wife told him. It’s not worth telling them. He waited and waited and waited. He hadn’t had news of his son for two days. On the third day they found his dumped body. Covered in bruises and holes. Colorless. Wasted. Eyes half shut. He also documented the extraordinary violence rocking his home town, with children routinely killed. The violence, he reported, had become “banal,” so common that young people would gather at crime scenes to take pictures and post them to social media. “This is cheap, easy death, crouching at two paces, near at hand, behind the corner, death not for having or not having a connection to narcotrafficking, but for living in a region wracked with violence and impunity, where crime is a routine and fear is no longer a novelty,” he wrote in 2015. “Culiacán, where it is dangerous to be alive, where everything is the same, except that on the skin of this northern region, a few steps from the Pacific and at the edge of the abyss, there are more bloodstains, scars, and crosses on the side of the road.”	204	"[{""start"": 1, ""end"": 260, ""text"": ""e I work, Culiacán, in the state of Sinaloa, Mexico, it is dangerous to be alive.” That's what Mexican journalist Javier Valdez said not too long ago, in 2011, when he accepted an International Press Freedom award from the Committee to Protect Journalists"", ""labels"": [""cause""]}, {""start"": 262, ""end"": 463, ""text"": ""Not only did Valdez work in one of the world's most dangerous countries for reporters — he also did some of the most dangerous work, covering crime and corruption in one of Mexico's most violent state"", ""labels"": [""cause""]}, {""start"": 466, ""end"": 646, ""text"": ""To do journalism is to walk on an invisible line drawn by the bad guys — who are in drug trafficking and in the government — in a field strewn with explosives,” he said at the tim"", ""labels"": [""cause""]}, {""start"": 701, ""end"": 842, ""text"": ""One must protect oneself from everything and everyone, and there do not seem to be options or salvation, and often there is no one to turn t"", ""labels"": [""cause""]}, {""start"": 845, ""end"": 1162, ""text"": ""On Monday afternoon, he was fatally shot near the offices of the newspaper he founded, Riodoce. He is the fifth reporter killed this year in Mexico, and his death comes just one day after about 100 assailants attacked seven national and international journalists covering a security operation in the state of Guerrero"", ""labels"": [""cause""]}, {""start"": 1164, ""end"": 1277, ""text"": ""hey were on the highway that leads to Iguala, where 43 students from a teacher training college vanished in 2014"", ""labels"": [""cause""]}, {""start"": 1556, ""end"": 1618, ""text"": ""In 2009, assailants hurled a grenade into the Riodoce newsroom"", ""labels"": [""cause""]}, {""start"": 1771, ""end"": 1921, ""text"": ""In a story from 2014, he described the pain of realizing that your child has been kidnapped: Raúl felt like his eyes were filling with shattered glass"", ""labels"": [""cause""]}, {""start"": 2000, ""end"": 2038, ""text"": ""One of his children had been kidnapped"", ""labels"": [""cause""]}, {""start"": 2038, ""end"": 3141, ""text"": "". The police said it was an abduction. But he knew instantly that they were going to call to ask for ransom. His cell phone rang. It rang to the tune of El palo verde. Its macabre sound during this tragedy made him feel ashamed. His sixteen-year old son. The middle child. He saw his wife bowled over, brought low, sat in an armchair with the pain of rushing salty tears drying her out.… He hit the green button on the Motorola and let out an imperceptible tremulous hello. Look you son of a bitch we have your kid. He pointed the phone at the boy so that he could let out the terrified cry of dad. He asked for money in exchange for letting him go and he explained where and how to drop it off.… He cried again. He begged him not to hurt his boy. He got the money together and he delivered it. He didn’t tell the police because he was afraid. They are one and the same his wife told him. It’s not worth telling them. He waited and waited and waited. He hadn’t had news of his son for two days. On the third day they found his dumped body. Covered in bruises and holes. Colorless. Wasted. Eyes half shut"", ""labels"": [""cause""]}, {""start"": 3481, ""end"": 3669, ""text"": ""death not for having or not having a connection to narcotrafficking, but for living in a region wracked with violence and impunity, where crime is a routine and fear is no longer a novelt"", ""labels"": [""cause""]}, {""start"": 701, ""end"": 844, ""text"": ""One must protect oneself from everything and everyone, and there do not seem to be options or salvation, and often there is no one to turn to."", ""labels"": [""causal-query""]}, {""start"": 1556, ""end"": 1618, ""text"": ""n 2009, assailants hurled a grenade into the Riodoce newsroom"", ""labels"": [""causal-query""]}]"	26	213	2023-03-24T17:00:51.549300Z	2023-03-24T17:00:51.549393Z	93.025
"For more than a year, Karla Silva typed out the news in a cramped storefront office for El Heraldo de Leon, a newspaper in the central Mexican town of Silao. The front door was always open, she said, so that passing residents could drop off tidbits of local interest. The city styled itself as a tourist destination, but the 24-year-old reporter’s stories sometimes explored darker themes. Last month, she quoted a local leader accusing the mayor of ignoring the plight of farmers and the crime wave in the area. She wrote about a video circulating of a rough police arrest and an “extreme abuse of authority.” At 5:30 p.m. Sept. 4, three young men walked into the office and faced Silva and a secretary. “They simply entered, one of them said my name, and when I looked up, he punched me in the face,” Silva recalled in a telephone interview. “After the first punch, I fell. And then he kicked me in the face, in the head, all over my body.” “He kept telling me to stop with my stories,” she said. News of the savage beating has spread widely in Mexico, a particularly dangerous country for reporters, as photos of Silva’s bloodied face circulated on the Internet. Suspicion immediately fell on the mayor, Enrique Benjamin Solis Arzola, who is from the ruling Institutional Revolutionary Party, the PRI. He has denied involvement. Threats, intimidation and physical violence are common against reporters in Mexico. More than 50 journalists have been killed or have disappeared there since 2007, according to the Committee to Protect Journalists, who condemned Silva’s beating. In dangerous cities, newspapers often go silent about violence, fearing retribution. Reporters for even the biggest national papers sometimes don’t use bylines when reporting from cartel-controlled areas. In the days since the attack, Silva’s colleagues have rallied around her. Earlier this week, about 100 journalists marched on the mayor’s office in Silao, shouting, “Karla is not alone"" and “We are all Karla,” and demanded his protection of the free press. But now that she's out of the hospital -- with swelling on the brain and blurred vision -- she said the attack may be enough to drive her from her profession. “I’m worried and scared,” she said. “As a journalist, I don’t know if I’m going to return to my job. Time will tell. I will do what is possible so that this doesn’t affect my work, but I haven’t decided.” “It’s very difficult what the journalists are confronting here every day,” she said. And as she told the Spanish newspaper, El Pais: “There is no worse enemy than a man who is afraid.” Gabriela Martinez contributed to this post."	203	"[{""start"": 390, ""end"": 997, ""text"": ""Last month, she quoted a local leader accusing the mayor of ignoring the plight of farmers and the crime wave in the area. She wrote about a video circulating of a rough police arrest and an “extreme abuse of authority.” At 5:30 p.m. Sept. 4, three young men walked into the office and faced Silva and a secretary. “They simply entered, one of them said my name, and when I looked up, he punched me in the face,” Silva recalled in a telephone interview. “After the first punch, I fell. And then he kicked me in the face, in the head, all over my body.” “He kept telling me to stop with my stories,” she said"", ""labels"": [""cause""]}, {""start"": 999, ""end"": 1165, ""text"": ""News of the savage beating has spread widely in Mexico, a particularly dangerous country for reporters, as photos of Silva’s bloodied face circulated on the Internet."", ""labels"": [""cause""]}, {""start"": 1332, ""end"": 1576, ""text"": ""Threats, intimidation and physical violence are common against reporters in Mexico. More than 50 journalists have been killed or have disappeared there since 2007, according to the Committee to Protect Journalists, who condemned Silva’s beating"", ""labels"": [""cause""]}, {""start"": 1578, ""end"": 1662, ""text"": ""n dangerous cities, newspapers often go silent about violence, fearing retribution."", ""labels"": [""cause""]}, {""start"": 2040, ""end"": 2315, ""text"": ""But now that she's out of the hospital -- with swelling on the brain and blurred vision -- she said the attack may be enough to drive her from her profession. “I’m worried and scared,” she said. “As a journalist, I don’t know if I’m going to return to my job. Time will tell."", ""labels"": [""cause""]}, {""start"": 2405, ""end"": 2487, ""text"": ""It’s very difficult what the journalists are confronting here every day,” she said"", ""labels"": [""cause""]}, {""start"": 1332, ""end"": 1494, ""text"": ""reats, intimidation and physical violence are common against reporters in Mexico. More than 50 journalists have been killed or have disappeared there since 2007"", ""labels"": [""causal-query""]}]"	26	212	2023-03-24T16:59:15.133690Z	2023-03-24T16:59:15.133786Z	79.143
As the Mexico City bureau chief for the Dallas Morning News for almost two decades, Alfredo Corchado has been on the front lines of the journalistic struggle to document the brutal toll of drug violence across Mexico. That struggle is among the world’s deadliest, with more than 60 Mexican journalists killed or having disappeared over the past decade, according to the Committee to Protect Journalists. “Mexico is one of the world’s most dangerous countries for journalists,” according to Reporters Without Borders. “They are threatened and murdered by organized crime or corrupt officials with impunity. The resulting climate of fear leads to self-censorship and undermines freedom of information.” Stories about government corruption, Mexico’s middle-class exodus and drug violence have placed Corchado on the receiving end of numerous death threats that have forced him to flee the country for months at a time. Like many of his courageous Mexican contemporaries, he has attempted to forge ahead, even as entire regions of the embattled nation — Sinaloa, Tamaulipas and Durango — have had their independent media silenced by the specter of violence. In these places, Corchado notes, nobody prints anything without cartel approval, including — it would seem — Sean Penn. [Censor or die: The death of Mexican news in the age of drug cartels] For Corchado and many of his colleagues, therein lies the problem with the American actor’s controversial first-person account of meeting with the notorious drug lord Joaquín “El Chapo” Guzmán. Corchado said the story — published Saturday by Rolling Stone and submitted for Guzmán’s approval before it was made public — is evidence of the inherent conflict between journalism and entertainment. “When you’re not really challenging the person and have agreed to submit the story for approval, it sounds more like a Hollywood entertainment,” Corchado, who was recently named the borderlands director of Arizona State’s Walter Cronkite’s School of Journalism, told The Washington Post. “It’s not on par with the sacrifice of many of my colleagues in Mexico and throughout the world who have lost their lives fighting censorship.” “Is he serving the public or is he aggrandizing himself?” he added, referring to Penn. It’s a question that has rippled across the journalism world, with the Rolling Stone story drawing as much criticism as it has undoubtedly drawn clicks. As The Post’s Dana Priest reported in December, newspaper readers in Mexico “are unaware of the life-and-death decisions editors make every day not to anger different local cartel commanders.” Hildebrando “Brando” Deandar Ayala — editor in chief of El Mañana, one of the oldest and largest newspapers in the region with a print circulation of 30,000 — told Priest that submitting to cartel censorship demands is a self-preservation tactic. “You do it or you die, and nobody wants to die,” he told The Post. “Auto censura — self-censorship — that’s our shield.” He added: “The readers hate us sometimes. But they don’t know the real risks we go through.” Priest’s report noted that “four El Mañana journalists have been killed in the past 10 years. Others survived assassination attempts, kidnappings, and grenade and machine-gun attacks on their offices. Deandar has been shot, kidnapped and had his home set on fire, he said.” The report added: The three largest U.S. newspapers nearby — the Brownsville Herald, the Monitor in McAllen, Tex., and the Laredo Morning Times — forbid their reporters from crossing to report because it’s too dangerous, according to the editors at the newspapers. To many observers, Penn’s sometimes playful prose revealed a troubling admiration for the man who “is one of the main players in the country’s bloody drug wars, which have claimed at least 100,000 lives over the last decade,” according to Quartz. “As you dive deeper into the meandering mess, it becomes clear that Penn holds some sort of Hollywood-inspired reverence for El Chapo,” Gawker’s Melissa Cronin writes in a post that catalogues the story’s worst lines. For others, Penn’s controversial account was reminiscent of the magazine’s 9,000-word debacle about a gang rape at the University of Virginia that never occurred. Jeet Heer, a senior editor for the New Republic, alluded to the fabricated account on Twitter, writing: “Rolling Stone sets standard journalist ethics aside to get story that will attract enormous attention. What could go wrong?” Others, such as Vice correspondent Danny Gold, called out journalists for their hypocrisy. He argued that Penn did what any other journalist desperate for the most sought-after scoop in the world would have done, according to CNN. “Never a fan of Penn’s journalism,” Gold wrote, “but me and every other journo would have compromised a whole lot more to get an interview with El Chapo. Anyone else who says otherwise is lying.” MSNBC’s Chris Hayes noted that ethical considerations have a way of becoming immaterial in the face of “enormous traffic.” Joel Simon, the executive director of the Committee to Protect Journalists, told The Post that he would let the media debate the ethics of Penn’s actions. Before making a judgement, however, he suggested that people consider the degree of self-censorship occurring in communities across Mexico. Journalists in Mexico, he noted, receive no protection from their government, which is often complicit in the risks they take to write about. Considering that meetings with high-level cartel members and the media are “highly unusual,” but not unheard of, he said the actor’s story should be judged by what it reveals. “Should journalists ever interview criminals?” Simon asked. “I would say sure.” “But if you as a journalist interview someone like El Chapo, you better deliver some valuable and important information, in my view,” he added. “In this particular instance, he had an assignment for a highly visible and important publication, and whether he delivered a story worthy of the risks he took, that’s something the editors have to decide and the media itself should be debating.” Noting how rare such an interview is, Corchado said he hopes some insight will come from giving the public any glimpse of the criminal mastermind. And yet, he’s still troubled by how the information was acquired. “Do I or other journalists wish we would have gotten the interview?” he added. “Of course, but I doubt that we would have been provided with the same protections of a Hollywood star. The interview also came with big strings attached, like final approval by Chapo of the article. That amounts to similar censorship that my Mexican colleagues face today. Except if they don’t comply, they may not live to tell about it.” This post, originally published on Jan. 10, has been updated. MORE READING: Can Mexican authorities hold ‘El Chapo’ now that they have him again? Why actress Kate del Castillo could be the biggest White House dinner ‘get’	202	"[{""start"": 218, ""end"": 402, ""text"": ""hat struggle is among the world’s deadliest, with more than 60 Mexican journalists killed or having disappeared over the past decade, according to the Committee to Protect Journalists"", ""labels"": [""cause""]}, {""start"": 405, ""end"": 476, ""text"": ""Mexico is one of the world’s most dangerous countries for journalists,"", ""labels"": [""cause""]}, {""start"": 518, ""end"": 605, ""text"": ""They are threatened and murdered by organized crime or corrupt officials with impunity."", ""labels"": [""cause""]}, {""start"": 1154, ""end"": 1342, ""text"": ""In these places, Corchado notes, nobody prints anything without cartel approval, including — it would seem — Sean Penn. [Censor or die: The death of Mexican news in the age of drug cartels"", ""labels"": [""cause""]}, {""start"": 2459, ""end"": 2601, ""text"": ""ewspaper readers in Mexico “are unaware of the life-and-death decisions editors make every day not to anger different local cartel commander"", ""labels"": [""cause""]}, {""start"": 2763, ""end"": 2917, ""text"": ""told Priest that submitting to cartel censorship demands is a self-preservation tactic. “You do it or you die, and nobody wants to die,” he told The Post."", ""labels"": [""cause""]}, {""start"": 5307, ""end"": 5448, ""text"": ""ournalists in Mexico, he noted, receive no protection from their government, which is often complicit in the risks they take to write about."", ""labels"": [""cause""]}, {""start"": 5307, ""end"": 5447, ""text"": ""Journalists in Mexico, he noted, receive no protection from their government, which is often complicit in the risks they take to write about"", ""labels"": [""causal-query""]}, {""start"": 518, ""end"": 605, ""text"": ""They are threatened and murdered by organized crime or corrupt officials with impunity."", ""labels"": [""causal-query""]}]"	26	211	2023-03-24T14:13:00.577142Z	2023-03-24T14:13:00.577248Z	6876.631
