text	id	answer	annotator	annotation_id	created_at	updated_at	lead_time
WHEN ONE of his colleagues at Mexico City’s daily newspaper was gunned down in March, Javier Valdez issued a passionate statement about the importance of the work of journalists who cover the network of organized crime, drug trafficking and corruption that plagues Mexico.“Let them kill us all, if that is the death sentence for reporting this hell,” he tweeted. “No to silence.” The words proved horribly prophetic when Mr. Valdez last week became the latest casualty of the drug-fueled violence that has claimed tens of thousands of Mexican lives over the past decade. The life and death of this courageous reporter should serve as inspiration and prod to the Mexican government to undertake reforms needed to end the impunity that allows the country’s lawlessness to flourish. Mr. Valdez, 50, was shot and killed at midday May 15 on a busy street in the northwest state of Sinaloa. Authorities said unidentified attackers fired 12 shots at his car. Sinaloa is a drug trafficking destination perhaps best known as the home of Mexican drug lord Joaquín “El Chapo” Guzmán; Mr. Valdez, a correspondent for La Jornada, co-founded a regional weekly newspaper there in 2003 because of his belief in the need for honest reporting of the crime and corruption that victimize Mexicans — despite the risks. He is the sixth journalist to be killed in Mexico this year and one of more than 100 journalists who have been murdered since 2000. Eleven days before Mr. Valdez’s death, a delegation from the Committee to Protect Journalists met with President Enrique Peña Nieto to present its newly released report “No Excuse: Mexico Must Break Cycle of Impunity in Journalists’ Murders.” Among the recommendations were better protections for at-risk journalists, timely investigation of threats and training prosecutors in how to pursue crimes against freedom of expression. It’s good that Mr. Peña Nieto immediately and strongly condemned Mr. Valdez’s murder, but that is clearly not enough. Recommendations of the CPJ report should be embraced, and the chronic failure of the judicial system in investigating and prosecuting crimes must be addressed. A good place to start is making a priority of finding those who shot Mr. Valdez and those who ordered it. Read more: Carl Gershman: Remembering a journalist who was killed for standing up to Putin Letters to the Editor: Journalists killed for dedication to the truth Aykan Erdemir and Cenk Sidar: Turkey’s bizarre witch hunt against the media	209	"[{""start"": 0, ""end"": 273, ""text"": ""N ONE of his colleagues at Mexico City’s daily newspaper was gunned down in March, Javier Valdez issued a passionate statement about the importance of the work of journalists who cover the network of organized crime, drug trafficking and corruption that plagues Mexico."", ""labels"": [""cause""]}, {""start"": 380, ""end"": 570, ""text"": ""he words proved horribly prophetic when Mr. Valdez last week became the latest casualty of the drug-fueled violence that has claimed tens of thousands of Mexican lives over the past decade."", ""labels"": [""cause""]}, {""start"": 780, ""end"": 951, ""text"": ""Mr. Valdez, 50, was shot and killed at midday May 15 on a busy street in the northwest state of Sinaloa. Authorities said unidentified attackers fired 12 shots at his car."", ""labels"": [""cause""]}, {""start"": 952, ""end"": 1071, ""text"": ""Sinaloa is a drug trafficking destination perhaps best known as the home of Mexican drug lord Joaquín “El Chapo” Guzmán"", ""labels"": [""cause""]}, {""start"": 1298, ""end"": 1428, ""text"": ""He is the sixth journalist to be killed in Mexico this year and one of more than 100 journalists who have been murdered since 2000"", ""labels"": [""cause""]}, {""start"": 1978, ""end"": 2136, ""text"": ""commendations of the CPJ report should be embraced, and the chronic failure of the judicial system in investigating and prosecuting crimes must be addressed"", ""labels"": [""cause""]}, {""start"": 2244, ""end"": 2434, ""text"": ""Read more: Carl Gershman: Remembering a journalist who was killed for standing up to Putin Letters to the Editor: Journalists killed for dedication to the truth Aykan Erdemir and Cenk Sidar:"", ""labels"": [""cause""]}, {""start"": 1978, ""end"": 2136, ""text"": ""commendations of the CPJ report should be embraced, and the chronic failure of the judicial system in investigating and prosecuting crimes must be addressed"", ""labels"": [""causal-query""]}]"	26	218	2023-03-24T17:11:52.189338Z	2023-03-24T17:11:52.189526Z	43.424
As the number of Mexican journalists killed for doing their jobs has spiked in recent months, organizations trying to draw attention to the murders have had to use stronger language to describe the epidemic. Amnesty International said it was “open season” on journalists and described a “war” against the media. The British human rights organization Article 19 described a “new peak” in violence. But a scathing new report by the Committee to Protect Journalists described the violence with a pointed word: preventable. The committee said government indifference and rampant corruption have contributed strongly to the attacks on journalists. “Endemic impunity allows criminal gangs, corrupt officials, and cartels to silence their critics,” the CPJ said in its report, released Wednesday, which was World Press Freedom Day. “Despite federal government efforts to combat this deadly cycle, justice remains elusive, and impunity the norm.” According to the CPJ, between 2006 and 2016, 21 journalists were killed in Mexico. The country ranks sixth on the organization's index of journalist killings that go unpunished. “The messenger risks being a victim of the story he or she investigates, at times at the hands of government officials, police commanders, common criminals, and drug traffickers who go unpunished,” wrote Adela Navarro Bello, director of Tijuana-based Zeta magazine, which is under police protection after authorities learned that a cartel planned to attack its headquarters. Carlos Lauría, the CPJ's senior program coordinator for the Americas, told The Washington Post that even when suspects are identified in journalist killings, the authorities rarely link the crimes back to cartels or their leaders. “The criminal justice system is incapable of providing any answers for journalists and their families who are being killed with impunity,” he said. “The collusion between the government and organized crime, yes, it’s a fact that it’s blocking the possibility of investigators ever getting to the bottom of these cases.” Citing the violence, the Mexican newspaper Norte in Ciudad Juárez announced last month that it was shutting down. “On this day, esteemed reader, I address you to report that I have made the decision to close this newspaper due to the fact that, among other things, there are neither the guarantees nor the security to exercise critical, counterbalance journalism,” wrote Norte’s owner, Oscar A. Cantú Murguía. In March, Norte journalist Miroslava Breach, 54, was fatally shot outside her home as she sat in her car with one of her three children. She had been reporting on killings assumed to be cartel-related, including attacks on police officers and gruesome beheadings. Breach was the third Mexican journalist slain in a month. The gunmen left a note near her body on a rolled-up piece of cardboard with a chilling reason for the crime: “being a tattletale.” In December 2015, The Washington Post's Dana Priest wrote about a call to a newspaper in Reynosa by an “enlace,” or a link to the cartels. The caller demanded that the newspaper retract a story about protection fees the city's mayor had paid to the cartel: The enlaces are part of the deeply institutionalized system of cartel censorship imposed on media outlets in northeastern Mexico abutting the border of Texas. How it works is an open secret in newsrooms here but not among readers. They are unaware of the life-and-death decisions editors make every day not to anger different local cartel commanders, each of whom has his own media philosophy. . . . Pervasive corruption abets the violence. Lauría told The Post that it's impossible for Mexicans to make an informed decision about their government or other issues if newspapers aren't protected and are afraid to print the truth. “It's a full-blown freedom of expression crisis,” he said. “It’s clearly affecting the health of the Mexican democracy. There are entire communities across Mexico where the people are not really aware of what’s going on.” Read more: A crooked cop’s execution-style killing in Texas exposes the ruthless inner workings of the Mexican Mafia Border agents beat an undocumented immigrant to death. The U.S. is paying his family $1 million. Texas woman kept Mexican slaves for 14 years, said they’d go to hell if they disobeyed A California waiter refused to serve 4 Latina customers until he saw ‘proof of residency’ This couple didn’t tip their Latina server. They left a hateful message instead.	208	"[{""start"": 7, ""end"": 206, ""text"": ""number of Mexican journalists killed for doing their jobs has spiked in recent months, organizations trying to draw attention to the murders have had to use stronger language to describe the epidemic"", ""labels"": [""cause""]}, {""start"": 208, ""end"": 518, ""text"": ""Amnesty International said it was “open season” on journalists and described a “war” against the media. The British human rights organization Article 19 described a “new peak” in violence. But a scathing new report by the Committee to Protect Journalists described the violence with a pointed word: preventable"", ""labels"": [""cause""]}, {""start"": 520, ""end"": 641, ""text"": ""The committee said government indifference and rampant corruption have contributed strongly to the attacks on journalists"", ""labels"": [""cause""]}, {""start"": 644, ""end"": 823, ""text"": ""mic impunity allows criminal gangs, corrupt officials, and cartels to silence their critics,” the CPJ said in its report, released Wednesday, which was World Press Freedom Day"", ""labels"": [""cause""]}, {""start"": 825, ""end"": 936, ""text"": ""“Despite federal government efforts to combat this deadly cycle, justice remains elusive, and impunity the norm"", ""labels"": [""cause""]}, {""start"": 939, ""end"": 1115, ""text"": ""According to the CPJ, between 2006 and 2016, 21 journalists were killed in Mexico. The country ranks sixth on the organization's index of journalist killings that go un"", ""labels"": [""cause""]}, {""start"": 1117, ""end"": 1490, ""text"": ""“The messenger risks being a victim of the story he or she investigates, at times at the hands of government officials, police commanders, common criminals, and drug traffickers who go unpunished,” wrote Adela Navarro Bello, director of Tijuana-based Zeta magazine, which is under police protection after authorities learned that a cartel planned to attack its headquarters"", ""labels"": [""cause""]}, {""start"": 1492, ""end"": 1722, ""text"": ""Carlos Lauría, the CPJ's senior program coordinator for the Americas, told The Washington Post that even when suspects are identified in journalist killings, the authorities rarely link the crimes back to cartels or their leaders."", ""labels"": [""cause""]}, {""start"": 1724, ""end"": 1869, ""text"": ""The criminal justice system is incapable of providing any answers for journalists and their families who are being killed with impunity,” he said"", ""labels"": [""cause""]}, {""start"": 1872, ""end"": 2040, ""text"": ""e collusion between the government and organized crime, yes, it’s a fact that it’s blocking the possibility of investigators ever getting to the bottom of these cases"", ""labels"": [""cause""]}, {""start"": 2158, ""end"": 2451, ""text"": ""On this day, esteemed reader, I address you to report that I have made the decision to close this newspaper due to the fact that, among other things, there are neither the guarantees nor the security to exercise critical, counterbalance journalism,” wrote Norte’s owner, Oscar A. Cantú Murguía"", ""labels"": [""cause""]}, {""start"": 2453, ""end"": 2903, ""text"": ""In March, Norte journalist Miroslava Breach, 54, was fatally shot outside her home as she sat in her car with one of her three children. She had been reporting on killings assumed to be cartel-related, including attacks on police officers and gruesome beheadings. Breach was the third Mexican journalist slain in a month. The gunmen left a note near her body on a rolled-up piece of cardboard with a chilling reason for the crime: “being a tattletale"", ""labels"": [""cause""]}, {""start"": 3163, ""end"": 3320, ""text"": ""The enlaces are part of the deeply institutionalized system of cartel censorship imposed on media outlets in northeastern Mexico abutting the border of Texas"", ""labels"": [""cause""]}, {""start"": 644, ""end"": 823, ""text"": ""ndemic impunity allows criminal gangs, corrupt officials, and cartels to silence their critics,” the CPJ said in its report, released Wednesday, which was World Press Freedom Day"", ""labels"": [""causal-query""]}, {""start"": 1872, ""end"": 2040, ""text"": ""he collusion between the government and organized crime, yes, it’s a fact that it’s blocking the possibility of investigators ever getting to the bottom of these cases"", ""labels"": [""causal-query""]}]"	26	217	2023-03-24T17:11:06.977559Z	2023-03-24T17:11:06.977696Z	210.211
"Despite their notoriety as such, Mexico's drug cartels aren't really drug cartels. For one, they're too busy shooting and torturing each other to collude on the kind of price-fixing arrangement that would qualify them as a proper cartel. Nor do they deal exclusively in drugs. Over the years, many of the country's most feared criminal gangs have developed lucrative portfolios in human trafficking, kidnapping, oil bunkering and especially extortion. What's less known is that they're also big in the news business. In major border cities like Nuevo Laredo and Reynosa, the gangsters essentially edit the local news, which is to say, they censor it. Besieged residents of those places may witness a wild gun battle in broad daylight and see bodies splayed out in the streets, but when they pick up a newspaper the next day, they won't find a word about it. This was not achieved by a few threatening phone calls. Over the years, the gangsters murdered, kidnapped and ran off many of Mexico's best crime reporters. They attacked newspaper offices and television studios with bullets and grenades. And while the intimidation campaign has fallen hardest on local news reporters, gunmen have also attacked and killed correspondents from Mexico's major national media outlets. These efforts to silence and censor the news are a big reason that a new law in Sinaloa, one of Mexico's most violent states, has triggered a wave of outrage since its approval last week. State lawmakers voted for new restrictions that essentially limit reporters to covering crime and violence only after authorities have given their permission. Under the new law, reporters will be prohibited from taking pictures or filming at crime scenes, and must wait for official news releases until publishing or broadcasting their reports. It wasn't clear how the laws would be enforced and what would happen to journalists and broadcasters who don't wait for state officials to tell them what they can cover. ""Let's imagine someone has been chopped to pieces, and the press arrives and starts taking photos, and publishing them online and in the media -- all of that is offensive to the victim's family and others,"" said Sinaloa lawmaker Roque Chavez, telling local reporters that the measures would improve the integrity of the judicial process and protect the work of forensic teams. But Javier Valdez, the award-winning reporter and co-founder of the Sinaloa-based weekly Rio Doce, described the measures as a blatant attack on the press -- and one that reflects the thinking of a political class that would rather stop journalists from covering violence than stop the violence itself. ""They're more worried about the news coverage than reality,"" he said. ""Our reality is one of murder, corruption and complicity between authorities and organized crime, and they want to cover that up for the sake of tourism and investment."" Due to take effect Oct. 15, Sinaloa's new reporting restrictions have been condemned by press freedom organizations in Mexico and abroad. Mexico's National Human Rights Commissioner Raul Plascencia called it ""a bad precedent"" for freedom of speech. They are particularly galling for the Mexican journalists who have risked their lives to report on the country's criminal organizations, and who have been urging lawmakers to provide them with more protections -- not new obstacles. Mexico ranked seventh this year on the ""Global Impunity"" index of countries where killings against journalists go unpunished -- the worst rating in the hemisphere -- according to an annual survey by the Committee to Protect Journalists. After several dozen reporters staged a protest Monday in Culiacan, the state capital, Sinaloa governor Mario López Valdez said he would meet with them and that the new legislation had been poorly drafted. The backlash against Sinaloa's state legislators has been so intense that lawmakers said they will introduce a new proposal Aug. 21 to repeal the measures, blaming its approval on a busy agenda that didn't leave enough time for the fine print. But Riodoce's Valdez said he's still skeptical. ""We can't let our guard down,"" he said, speaking by phone from Sinaloa. Of course, not all Mexican reporters are noble crusaders for truth and justice. Some take money in exchange for favorable coverage, or no coverage at all. Carnage-crazed tabloids tend to outnumber serious news outlets. Yet Mexico remains a country with a fairly vibrant and mostly-free press, and one that has hung on through a dark and scary era when powerful forces from the underworld and the political world have wanted to gag it. There were times in Ciudad Juarez in 2010 and 2011, when the city was at its deadliest, that it wasn't unusual for 10, 12 or 15 people to be slain in a single day. You could follow the local crime reporters to homicide scenes all around the city and see the bodies in the streets where they fell. These reporters and photographers followed the police radio traffic and paid cops and others for tips, wanting to arrive first so they could get close-ups of the dead before the forensic teams got there and sealed off the area with tape. Showing up at homicide scenes too early carried its own risks, especially when the police hadn't arrived yet and it wasn't clear whether the killing was finished. Gunmen would sometimes circle back to finish off the wounded. Still, I never saw reporters get in the way or interfere with a crime scene. More importantly, I know that if they hadn't been there at all, there would be no way to know whether the deaths would be noted, documented and tallied, or if they'd be simply cleaned up and concealed, as if nothing ever happened, as some would have preferred."	207	"[{""start"": 277, ""end"": 516, ""text"": ""Over the years, many of the country's most feared criminal gangs have developed lucrative portfolios in human trafficking, kidnapping, oil bunkering and especially extortion. What's less known is that they're also big in the news business."", ""labels"": [""cause""]}, {""start"": 517, ""end"": 649, ""text"": ""In major border cities like Nuevo Laredo and Reynosa, the gangsters essentially edit the local news, which is to say, they censor it"", ""labels"": [""cause""]}, {""start"": 858, ""end"": 1272, ""text"": ""This was not achieved by a few threatening phone calls. Over the years, the gangsters murdered, kidnapped and ran off many of Mexico's best crime reporters. They attacked newspaper offices and television studios with bullets and grenades. And while the intimidation campaign has fallen hardest on local news reporters, gunmen have also attacked and killed correspondents from Mexico's major national media outlets."", ""labels"": [""cause""]}, {""start"": 1461, ""end"": 1619, ""text"": ""State lawmakers voted for new restrictions that essentially limit reporters to covering crime and violence only after authorities have given their permission."", ""labels"": [""cause""]}, {""start"": 2353, ""end"": 2655, ""text"": ""But Javier Valdez, the award-winning reporter and co-founder of the Sinaloa-based weekly Rio Doce, described the measures as a blatant attack on the press -- and one that reflects the thinking of a political class that would rather stop journalists from covering violence than stop the violence itself."", ""labels"": [""cause""]}, {""start"": 3377, ""end"": 3612, ""text"": ""Mexico ranked seventh this year on the \""Global Impunity\"" index of countries where killings against journalists go unpunished -- the worst rating in the hemisphere -- according to an annual survey by the Committee to Protect Journalists"", ""labels"": [""cause""]}, {""start"": 3145, ""end"": 3375, ""text"": ""They are particularly galling for the Mexican journalists who have risked their lives to report on the country's criminal organizations, and who have been urging lawmakers to provide them with more protections -- not new obstacles"", ""labels"": [""cause""]}, {""start"": 4402, ""end"": 4617, ""text"": ""Yet Mexico remains a country with a fairly vibrant and mostly-free press, and one that has hung on through a dark and scary era when powerful forces from the underworld and the political world have wanted to gag it."", ""labels"": [""cause""]}, {""start"": 4618, ""end"": 4780, ""text"": ""ere were times in Ciudad Juarez in 2010 and 2011, when the city was at its deadliest, that it wasn't unusual for 10, 12 or 15 people to be slain in a single day"", ""labels"": [""cause""]}, {""start"": 4782, ""end"": 4913, ""text"": ""You could follow the local crime reporters to homicide scenes all around the city and see the bodies in the streets where they fel"", ""labels"": [""cause""]}, {""start"": 4782, ""end"": 4913, ""text"": ""You could follow the local crime reporters to homicide scenes all around the city and see the bodies in the streets where they fell"", ""labels"": [""causal-query""]}, {""start"": 2353, ""end"": 2655, ""text"": ""But Javier Valdez, the award-winning reporter and co-founder of the Sinaloa-based weekly Rio Doce, described the measures as a blatant attack on the press -- and one that reflects the thinking of a political class that would rather stop journalists from covering violence than stop the violence itself."", ""labels"": [""causal-query""]}]"	26	216	2023-03-24T17:07:25.613164Z	2023-03-24T17:07:32.204945Z	110.98400000000001
